{
  "schema": "heisentick/session-feature-rows",
  "version": 1,
  "instrument": "XAUUSD",
  "timeframe": "5m",
  "sessionConfig": {
    "asiaStartHourUtc": 0,
    "asiaEndHourUtc": 7,
    "londonStartHourUtc": 7,
    "valueAreaPercent": 70,
    "sessionRows": 24,
    "dayRows": 36,
    "minAsiaBars": 60
  },
  "engine": {
    "package": "@heisentick/engine",
    "version": "1.0.0",
    "gitSha": "a1b2c3d4e5f60718293a4b5c6d7e8f90a1b2c3d"
  },
  "source": {
    "dataFile": "5m.json",
    "sha256": "aaaaaaaaaaaaaaaaaaaaaaaaaaaaaaaaaaaaaaaaaaaaaaaaaaaaaaaaaaaaaaaa"
  },
  "generatedAt": 1600090000000,
  "rows": [
    {
      "date": "2026-01-05",
      "decisionTs": 1600000000000,
      "asia": {
        "open": 2000.1,
        "high": 2005.4,
        "low": 1998.2,
        "close": 2002.7,
        "barCount": 84,
        "poc": 2001.5,
        "vah": 2003.8,
        "val": 1999.6,
        "delta": 12.4,
        "rangeEstimators": {
          "parkinsonBp": 41.2,
          "garmanKlassBp": 39.7,
          "rogersSatchellBp": 40.5
        }
      },
      "londonOpen": 2002.9,
      "priorDayAtr14": 18.6,
      "priorDay": {
        "high": 2010.2,
        "low": 1990.5,
        "close": 2003.4,
        "poc": 1999.4,
        "vah": 2003.1,
        "val": 1996.2
      },
      "features": {
        "asiaPocZone": "middle",
        "asiaPocSide": "nearMid",
        "asiaCloseVsPoc": "above",
        "londonOpenVsAsiaPoc": "above",
        "londonOpenVsAsiaValue": "insideVA",
        "asiaDeltaSign": "positive",
        "asiaDirection": "up",
        "asiaVaWidth": "normal",
        "priorDayPocZone": "middle",
        "priorDayCloseVsPoc": "above",
        "londonOpenVsPriorDayPoc": "above",
        "londonOpenVsPriorDayValue": "aboveVA",
        "asiaPocVsPriorDayPoc": "above"
      }
    },
    {
      "date": "2026-01-06",
      "decisionTs": 1600086400000,
      "asia": {
        "open": 2002.9,
        "high": 2004,
        "low": 2001,
        "close": 2001.2,
        "barCount": 61,
        "poc": 2002.1,
        "vah": 2003.5,
        "val": 2001.4,
        "delta": -3.1
      },
      "londonOpen": 2001.3,
      "priorDay": null,
      "features": {
        "asiaPocZone": null,
        "asiaPocSide": null,
        "asiaCloseVsPoc": "below",
        "londonOpenVsAsiaPoc": "below",
        "londonOpenVsAsiaValue": "belowVA",
        "asiaDeltaSign": "negative",
        "asiaDirection": "down",
        "asiaVaWidth": "narrow",
        "priorDayPocZone": null,
        "priorDayCloseVsPoc": null,
        "londonOpenVsPriorDayPoc": null,
        "londonOpenVsPriorDayValue": null,
        "asiaPocVsPriorDayPoc": null
      }
    }
  ]
}
